Product,Handle,Price,SKU,Availability,Variant Title,Variant ID,Weight,Inventory Management,Product URL,Scraped at,Description
Small Duck Toy,duck-toy-no-name,429.0,,True,Default Title,47655187546410,0,shopify,https://www.triconuts.com//products/duck-toy-no-name,2026/02/22 02:06:19 PM,"Handmade crochet duck, soft and cuddly — the perfect 18 cm companion for babies, toddlers, and nursery decor. This charming handmade crochet duck is crafted with love and care, making it the perfect gift for babies, toddlers, or anyone who loves cute and cozy companions. Measuring approximately 18 cm in height, this soft and lightweight duck features a round body, adorable wings, and embroidered facial details for extra safety and charm. Made from high-quality, baby-safe yarn, it’s ideal as a thoughtful baby shower gift, nursery decoration, or a cuddly friend for little hands. Its delightful design brings warmth and joy to any space. ✅ Handmade with love ✅ Baby-safe natural materials ✅ Exclusive design by Triconuts"
Sheep Toy (Extra Soft),sheep-toy-extra-soft,899.0,,True,Default Title,49999270248746,0,shopify,https://www.triconuts.com//products/sheep-toy-extra-soft,2026/02/22 02:06:20 PM,100% handcrafted Safe for babies & kids Material: Yarn & Fiber only (no plastic) Height: 36 cm approx. Color: Beige + White Hand wash only
Turtle Toy (Extra Soft),turtle-toy-extra-soft,899.0,,True,Default Title,50354057412906,0,shopify,https://www.triconuts.com//products/turtle-toy-extra-soft,2026/02/22 02:06:21 PM,100% handcrafted Safe for babies & kids Material: Yarn & Fiber only (no plastic) Height: 30 cm approx. Color: Mint + Beige Hand wash only
Pompoms Blanket (Grey),pompoms-blanket-grey,1269.0,,True,Default Title,51012119920938,0,shopify,https://www.triconuts.com//products/pompoms-blanket-grey,2026/02/22 02:06:22 PM,"Designed and handmade in Egypt For customized size or color, pleasecontact us Please follow the care instructions to maintain appearance and extend the life of your garmentHere"
Tiny Teddy Girl Toy,tiny-teddy-girl-toy,329.0,,False,Default Title,50375755432234,0,shopify,https://www.triconuts.com//products/tiny-teddy-girl-toy,2026/02/22 02:06:23 PM,
Xmas Special Packaging,xmas-special-package,50.0,,True,Default Title,50904546509098,0,,https://www.triconuts.com//products/xmas-special-package,2026/02/22 02:06:25 PM,Want to get your order in a cute xmas package? 📦♥️🎄 add this item to your order 🥰
Winnie Pooh Toy (Extra Soft),winnie-pooh-toy-extra-soft,839.0,,True,Default Title,50006862889258,0,shopify,https://www.triconuts.com//products/winnie-pooh-toy-extra-soft,2026/02/22 02:06:26 PM,100% handcrafted Safe for babies & kids Material: Yarn & Fiber only (no plastic) Color: Yellow + Red Height: 30 cm approx. Hand wash only
Winter Pink Scarf (EXTRA SOFT),winter-scarf-extra-soft,539.0,,True,Default Title,51039222530346,0,shopify,https://www.triconuts.com//products/winter-scarf-extra-soft,2026/02/22 02:06:26 PM,"Soft Knit Baby Scarf – Cozy & Cute Winter Essential ❄️ Keep your little one warm and stylish with our adorable handmade baby scarf. Crafted from ultra-soft yarn, this cozy knit scarf is gentle on delicate baby skin and perfect for chilly days. Designed with a playful pom-pom finish, it adds a cute touch to any winter outfit while providing extra warmth and comfort. Lightweight, snug, and easy to wear, this scarf is ideal for everyday outings, photoshoots, or as a thoughtful winter gift for babies. ✨ Why parents love it: A must-have winter accessory for your little bundle of joy 🤍 Size 100 cm * 14 cm aprox"
Xmas Bunny Toy,xmas-bunny-toy,499.0,,True,Default Title,49638351733034,0,shopify,https://www.triconuts.com//products/xmas-bunny-toy,2026/02/22 02:06:27 PM,100% handcrafted Bunny toy for girls Safe for babies & kids Material: Yarn & Fiber only (no plastic) Height: 25 cm approx. Hand wash only
Xmas Gift Card,xmas-gift-card,250.0,,True,E£250.00,50900945436970,0,,https://www.triconuts.com//products/xmas-gift-card,2026/02/22 02:06:28 PM,"🎁Triconuts Gift Card Give the gift of choice! Not sure which toy to pick? Send a Triconuts Gift Card and let them choose their favorite handmade piece. Why you’ll love it: • Delivered instantly via email • No shipping fees • Can be used on all Triconuts products • Perfect for Christmas, birthdays & baby showers Available Values: EGP 250 • EGP 500 • EGP 1,000 A simple gift that brings real joy ✨"
Xmas Gift Card,xmas-gift-card,500.0,,True,E£500.00,50900945469738,0,,https://www.triconuts.com//products/xmas-gift-card,2026/02/22 02:06:28 PM,"🎁Triconuts Gift Card Give the gift of choice! Not sure which toy to pick? Send a Triconuts Gift Card and let them choose their favorite handmade piece. Why you’ll love it: • Delivered instantly via email • No shipping fees • Can be used on all Triconuts products • Perfect for Christmas, birthdays & baby showers Available Values: EGP 250 • EGP 500 • EGP 1,000 A simple gift that brings real joy ✨"
Xmas Gift Card,xmas-gift-card,1000.0,,True,"E£1,000.00",50900945502506,0,,https://www.triconuts.com//products/xmas-gift-card,2026/02/22 02:06:28 PM,"🎁Triconuts Gift Card Give the gift of choice! Not sure which toy to pick? Send a Triconuts Gift Card and let them choose their favorite handmade piece. Why you’ll love it: • Delivered instantly via email • No shipping fees • Can be used on all Triconuts products • Perfect for Christmas, birthdays & baby showers Available Values: EGP 250 • EGP 500 • EGP 1,000 A simple gift that brings real joy ✨"
White Girl Bunny Toy,girl-bunny-toy,499.0,,True,Default Title,44188791144746,0,shopify,https://www.triconuts.com//products/girl-bunny-toy,2026/02/22 02:06:29 PM,"Soft handmade crochet bunny, 25 cm tall — perfect for babies, kids, and as a charming nursery decoration. This adorable handmade crochet bunny is the perfect gift for babies, children, or anyone who loves soft, cuddly toys. Measuring 25 cm in height, this bunny is crafted with care using soft, high-quality yarn, making it gentle and safe for little hands. Its sweet embroidered face and delicate pink bow add a touch of charm, while its lightweight and durable design ensures it will be cherished for years to come. Ideal as a baby shower gift, nursery decor, or a comforting bedtime companion. ✅ Handmade with love ✅ Baby-safe natural materials ✅ Exclusive design by Triconuts"
Winter Blue Scarf (EXTRA SOFT),winter-blue-scarf-extra-soft,539.0,,True,Default Title,51039242780970,0,shopify,https://www.triconuts.com//products/winter-blue-scarf-extra-soft,2026/02/22 02:06:30 PM,"Soft Knit Baby Scarf – Cozy & Cute Winter Essential ❄️ Keep your little one warm and stylish with our adorable handmade baby scarf. Crafted from ultra-soft yarn, this cozy knit scarf is gentle on delicate baby skin and perfect for chilly days. Designed with a playful pom-pom finish, it adds a cute touch to any winter outfit while providing extra warmth and comfort. Lightweight, snug, and easy to wear, this scarf is ideal for everyday outings, photoshoots, or as a thoughtful winter gift for babies. ✨ Why parents love it: A must-have winter accessory for your little bundle of joy 🤍 Size 100 cm * 14 cm aprox"
White Boy Bunny Toy,boy-bunny-toy,499.0,,True,Default Title,44188844785962,0,shopify,https://www.triconuts.com//products/boy-bunny-toy,2026/02/22 02:06:31 PM,"Handmade 25 cm crochet bunny with a blue bow tie. Soft, safe, and perfect for babies and toddlers. Meet our adorable handmade crochet bunny – a timeless gift for your little one. With its soft white body, classic long ears, and sweet blue bow tie, this 25 cm bunny is designed to be both charming and safe. Made with baby-friendly cotton yarn, it’s ideal for cuddles, nursery decor, and keepsake photos. Whether you’re gifting a newborn, decorating a baby shower, or looking for a thoughtful first toy, this bunny is sure to be a favorite for years to come. ✅ 100% handmade with love ✅ Hypoallergenic and safe materials ✅ Exclusive Triconuts design ✅ Suitable from birth"
Yellow Velvet Blanket (Super Soft),yellow-velvet-blanket-super-soft,1259.0,,True,Default Title,51012246372650,0,shopify,https://www.triconuts.com//products/yellow-velvet-blanket-super-soft,2026/02/22 02:06:32 PM,"Designed and handmade in Egypt For customized size or color, pleasecontact us Please follow the care instructions to maintain appearance and extend the life of your garmentHere"
White Velvet Blanket (Super Soft),white-velvet-blanket-super-soft,1259.0,,True,Default Title,51012290117930,0,shopify,https://www.triconuts.com//products/white-velvet-blanket-super-soft,2026/02/22 02:06:33 PM,"Designed and handmade in Egypt For customized size or color, pleasecontact us Please follow the care instructions to maintain appearance and extend the life of your garmentHere"
